{
  "canonical_admission": "NOT_EVALUATED",
  "chart_axis_rescaled": false,
  "completeness": "COMPLETE_INPUT_VIEW",
  "current_authority": "NOT_EVALUATED",
  "decision": {
    "action": "SINGLE_COMPLETE",
    "rationale": "entire declared source is visible in this projection",
    "status": "descriptive_display_only"
  },
  "dimensions": {
    "granularity": "detail",
    "lens": "cube.lens.epistemology",
    "view": "cube.tree"
  },
  "displayed_item_ids": [
    "core",
    "runtime",
    "adapter",
    "connector",
    "toolbox"
  ],
  "displayed_lens_declarations": 9,
  "displayed_source_edge_ids": [
    "e1",
    "e2",
    "e3",
    "e4"
  ],
  "epistemic_warrant": "NOT_EVALUATED",
  "format": "aiaeao.cube.vp05-conformance-report/1",
  "invariants_passed": [
    "SOURCE_SHA256_LOCK",
    "CUBE_VIEW_NAMESPACE",
    "DECLARED_LENS_ONLY",
    "GRANULARITY_SCOPE",
    "EXACT_ITEM_PARTITION",
    "EXACT_EDGE_PARTITION",
    "LOSS_LEDGER_BALANCED",
    "ORIGINAL_ITEMS_UNCHANGED",
    "ORIGINAL_EDGES_UNCHANGED",
    "TREE_ANCESTOR_CLOSURE",
    "LENS_EDGE_REMAP_DECLARED",
    "EXACT_LENS_BINDING_PARTITION",
    "SVG_SOURCE_LOCK",
    "NO_ACTIVE_SVG_CONTENT",
    "ONE_EMBEDDED_LOSS_LEDGER",
    "EMBEDDED_REPORT_MATCH",
    "NO_SEMANTIC_AUTHORITY_PROMOTION",
    "SOURCE_IS_DECLARED_UNVERIFIED",
    "INDEPENDENT_ORACLE_SOURCE_ITEMS",
    "INDEPENDENT_ORACLE_SHOWN_ITEMS",
    "INDEPENDENT_ORACLE_SHOWN_EDGES",
    "INDEPENDENT_ORACLE_COMPLETENESS"
  ],
  "limits": [
    "Split feasibility is a heuristic, not a generated multi-page export or optimal partition",
    "Glyph rendering varies with installed fonts",
    "P1 semantic conformance is not evaluated by the SVG printer"
  ],
  "omitted_item_ids": [],
  "omitted_lens_declarations": 0,
  "omitted_source_edge_ids": [],
  "profile": "P2-VP-CONFORMANCE/0.5.0",
  "reference_version": "v9.4",
  "source_bundle_sha256": "01d07868b1f71e03c2a240ac83e31627c63cf5aa84f09c211e704d762ae51e15",
  "source_status": "declared_unverified",
  "split_feasibility": {
    "estimated_panel_count": 1,
    "is_minimum_proven": false,
    "panels": [
      {
        "focus": null,
        "shown_edge_ids": [
          "e1",
          "e2",
          "e3",
          "e4"
        ],
        "shown_item_ids": [
          "adapter",
          "connector",
          "core",
          "runtime",
          "toolbox"
        ]
      }
    ],
    "panels_materialized": false,
    "repeated_item_ids": [],
    "status": "NOT_REQUIRED",
    "strategy": "focused_panels_from_immutable_source",
    "unavailable_focus_count": 0,
    "uncovered_edge_ids": [],
    "uncovered_item_ids": []
  },
  "status": "PASS",
  "svg_sha256": "a625dbdaf614332434842fdf89d302ae14204d11806ee8418da1bc96e588db39",
  "vp04_report_sha256": "acfe374e1e07be7f043e7d3c6775ee1906c5eb0e23b35f1f3bd9b864fcbd8c03"
}
