{
  "canonical_admission": "NOT_EVALUATED",
  "chart_axis_rescaled": false,
  "completeness": "PARTIAL_EXPLICIT",
  "current_authority": "NOT_EVALUATED",
  "decision": {
    "action": "SINGLE_DISCLOSED",
    "rationale": "intentional bounded reduction with explicit item/edge disclosure",
    "status": "descriptive_display_only"
  },
  "dimensions": {
    "granularity": "overview",
    "lens": "cube.lens.execution",
    "view": "cube.tree"
  },
  "displayed_item_ids": [
    "core",
    "runtime",
    "toolbox"
  ],
  "displayed_lens_declarations": 4,
  "displayed_source_edge_ids": [
    "e1",
    "e4"
  ],
  "epistemic_warrant": "NOT_EVALUATED",
  "format": "aiaeao.cube.vp05-conformance-report/1",
  "invariants_passed": [
    "SOURCE_SHA256_LOCK",
    "CUBE_VIEW_NAMESPACE",
    "DECLARED_LENS_ONLY",
    "GRANULARITY_SCOPE",
    "EXACT_ITEM_PARTITION",
    "EXACT_EDGE_PARTITION",
    "LOSS_LEDGER_BALANCED",
    "ORIGINAL_ITEMS_UNCHANGED",
    "ORIGINAL_EDGES_UNCHANGED",
    "TREE_ANCESTOR_CLOSURE",
    "EXACT_LENS_BINDING_PARTITION",
    "SVG_SOURCE_LOCK",
    "NO_ACTIVE_SVG_CONTENT",
    "ONE_EMBEDDED_LOSS_LEDGER",
    "EMBEDDED_REPORT_MATCH",
    "NO_SEMANTIC_AUTHORITY_PROMOTION",
    "SOURCE_IS_DECLARED_UNVERIFIED",
    "INDEPENDENT_ORACLE_SOURCE_ITEMS",
    "INDEPENDENT_ORACLE_SHOWN_ITEMS",
    "INDEPENDENT_ORACLE_SHOWN_EDGES",
    "INDEPENDENT_ORACLE_COMPLETENESS"
  ],
  "limits": [
    "Split feasibility is a heuristic, not a generated multi-page export or optimal partition",
    "Glyph rendering varies with installed fonts",
    "P1 semantic conformance is not evaluated by the SVG printer"
  ],
  "omitted_item_ids": [
    "adapter",
    "connector"
  ],
  "omitted_lens_declarations": 5,
  "omitted_source_edge_ids": [
    "e2",
    "e3"
  ],
  "profile": "P2-VP-CONFORMANCE/0.5.0",
  "reference_version": "v9.4",
  "source_bundle_sha256": "01d07868b1f71e03c2a240ac83e31627c63cf5aa84f09c211e704d762ae51e15",
  "source_status": "declared_unverified",
  "split_feasibility": {
    "estimated_panel_count": 3,
    "is_minimum_proven": false,
    "panels": [
      {
        "focus": null,
        "shown_edge_ids": [
          "e1",
          "e4"
        ],
        "shown_item_ids": [
          "core",
          "runtime",
          "toolbox"
        ]
      },
      {
        "focus": {
          "id": "e2",
          "kind": "edge"
        },
        "shown_edge_ids": [
          "e1",
          "e2"
        ],
        "shown_item_ids": [
          "adapter",
          "core",
          "runtime"
        ]
      },
      {
        "focus": {
          "id": "e3",
          "kind": "edge"
        },
        "shown_edge_ids": [
          "e1",
          "e3"
        ],
        "shown_item_ids": [
          "connector",
          "core",
          "runtime"
        ]
      }
    ],
    "panels_materialized": false,
    "repeated_item_ids": [
      "core",
      "runtime"
    ],
    "status": "FEASIBLE",
    "strategy": "focused_panels_from_immutable_source",
    "unavailable_focus_count": 0,
    "uncovered_edge_ids": [],
    "uncovered_item_ids": []
  },
  "status": "PASS",
  "svg_sha256": "234b82617c7335fa556ec5917d561fee321d15204fe3bfff8ae5fc5e381fa4f9",
  "vp04_report_sha256": "546f72b51df8d9b903a271a7b6c5f410d1146e11f85f13338a30eefb96e776c9"
}
