{
  "canonical_admission": "NOT_EVALUATED",
  "chart_axis_rescaled": false,
  "completeness": "COMPLETE_INPUT_VIEW",
  "current_authority": "NOT_EVALUATED",
  "decision": {
    "action": "SINGLE_COMPLETE",
    "rationale": "entire declared source is visible in this projection",
    "status": "descriptive_display_only"
  },
  "dimensions": {
    "granularity": "detail",
    "lens": "cube.lens.epistemology",
    "view": "cube.flow"
  },
  "displayed_item_ids": [
    "artifact",
    "resource"
  ],
  "displayed_lens_declarations": 9,
  "displayed_source_edge_ids": [
    "e1"
  ],
  "epistemic_warrant": "NOT_EVALUATED",
  "format": "aiaeao.cube.vp05-conformance-report/1",
  "invariants_passed": [
    "SOURCE_SHA256_LOCK",
    "CUBE_VIEW_NAMESPACE",
    "DECLARED_LENS_ONLY",
    "GRANULARITY_SCOPE",
    "EXACT_ITEM_PARTITION",
    "EXACT_EDGE_PARTITION",
    "LOSS_LEDGER_BALANCED",
    "ORIGINAL_ITEMS_UNCHANGED",
    "ORIGINAL_EDGES_UNCHANGED",
    "LENS_EDGE_REMAP_DECLARED",
    "EXACT_LENS_BINDING_PARTITION",
    "SVG_SOURCE_LOCK",
    "NO_ACTIVE_SVG_CONTENT",
    "ONE_EMBEDDED_LOSS_LEDGER",
    "EMBEDDED_REPORT_MATCH",
    "NO_SEMANTIC_AUTHORITY_PROMOTION",
    "SOURCE_IS_DECLARED_UNVERIFIED",
    "INDEPENDENT_ORACLE_SOURCE_ITEMS",
    "INDEPENDENT_ORACLE_SHOWN_ITEMS",
    "INDEPENDENT_ORACLE_SHOWN_EDGES",
    "INDEPENDENT_ORACLE_COMPLETENESS"
  ],
  "limits": [
    "Split feasibility is a heuristic, not a generated multi-page export or optimal partition",
    "Glyph rendering varies with installed fonts",
    "P1 semantic conformance is not evaluated by the SVG printer"
  ],
  "omitted_item_ids": [],
  "omitted_lens_declarations": 0,
  "omitted_source_edge_ids": [],
  "profile": "P2-VP-CONFORMANCE/0.5.0",
  "reference_version": "v9.4",
  "source_bundle_sha256": "364e9b33d95ab0419410136287ac3f3e0d4e55ec8a7d5eaa66611dc26eaaf4ed",
  "source_status": "declared_unverified",
  "split_feasibility": {
    "estimated_panel_count": 1,
    "is_minimum_proven": false,
    "panels": [
      {
        "focus": null,
        "shown_edge_ids": [
          "e1"
        ],
        "shown_item_ids": [
          "artifact",
          "resource"
        ]
      }
    ],
    "panels_materialized": false,
    "repeated_item_ids": [],
    "status": "NOT_REQUIRED",
    "strategy": "focused_panels_from_immutable_source",
    "unavailable_focus_count": 0,
    "uncovered_edge_ids": [],
    "uncovered_item_ids": []
  },
  "status": "PASS",
  "svg_sha256": "ae1af2bbb6be006f7a589686216d62f2260b95e426b9960a2368433a91964559",
  "vp04_report_sha256": "16bd4a2bf1de870a864c661eb5556bdf1a9232cae484429d11469460fc3c8e23"
}
